Citation,Entity Empowered,Triggering Event,Location
Executive Order 12148,"Federal Emergency Management Agency,Department of Housing and Urban Development,Department of Defense,Department of Commerce,General Services Administration",No triggering event - Capacity Building,Domestic
Executive Order 13618,"Department of State,Department of Defense,Department of Justice,Department of Commerce,Department of Homeland Security,Federal Communications Commission,General Services Administration",No triggering event - Capacity Building,Domestic
Presidential Policy Directive 21,"Department of Homeland Security,Department of State,Department of Justice,Department of Defense,Department of the Interior,Department of Commerce,Department of Energy,Department of the Treasury,Department of Agriculture,Department of Transportation,Environmental Protection Agency,Department of Health and Human Services,General Services Administration",No triggering event - Capacity Building,Domestic
48 C.F.R. § 18,"General Services Administration,Department of Defense,National Aeronautics and Space Administration","Terrorism,Act of War,Presidential Major Disaster Declaration,Presidential Emergency Declarations,NEA Emergency Declaration,Natural Disaster",Both
10 U.S.C. § 2662,"Department of Defense,POTUS or Executive Office of the President of the United States,General Services Administration","NEA Emergency Declaration,Act of War,Declaration of War",Domestic
40 U.S.C. § 545,General Services Administration,NEA Emergency Declaration,Both
40 U.S.C. § 905,General Services Administration,NEA Emergency Declaration,Domestic
50 U.S.C. § 4309,General Services Administration,NEA Emergency Declaration,Domestic
